{
  "id": "tjdft-ana-maria-cantarino",
  "nome": "Desa. Ana Maria Cantarino",
  "nome_completo": null,
  "orgao": "TJDFT",
  "cargo": "Desembargador",
  "situacao": "titular",
  "dados_publicos": {
    "assessor": "Maria Aparecida Lima Algarte",
    "telefones_gabinete": "(61)3103-5653, (61)3103-5679, (61)3103-5614, (61)3103-5674",
    "biografia_tjdft_url": "https://www.tjdft.jus.br/institucional/gestao-do-conhecimento/gestao-da-memoria/biografias/124-ana-maria-cantarino-3-1.pdf",
    "biografia_tjdft_texto": "124 \nBIOGRAFIA \nDESEMBARGADORA \nANA MARIA CANTARINO \n \nDADOS PESSOAIS \nNOME: Ana Maria Cantarino \nDATA DE NASCIMENTO: 24/3/1963 \nLOCAL DE NASCIMENTO: Vila Matias \u2013 MG \nNACIONALIDADE: Brasileira \n \n \n \n \n \n \n \n \n \n \n \n \nESCOLARIDADE \n \nCurso Prim\u00e1rio: Grupo Escolar Theolinda de Sousa Carmo \u2013 Governador Valadares (MG) - 1971 a 1974. \nCurso Ginasial: Escola Polivalente de Governador Valadares (MG) - 1975 a 1978. \nCurso Colegial: Funda\u00e7\u00e3o Educacional do Distrito Federal/DF - 1979 a 1981. \nCurso Superior: Bacharelado em Direito pelo CEUB \u2013 Centro de Ensino Unificado de Bras\u00edlia - 1988. \n \nCARGOS OCUPADOS \n \n\u00bb Secret\u00e1ria no Escrit\u00f3rio de Advocacia Carlos Gomes Sanrom\u00e3, no per\u00edodo de 1982 a 1984. \n\u00bb Estagi\u00e1ria de Direito no Escrit\u00f3rio de Advocacia Carlos Gomes Sanrom\u00e3, no per\u00edodo de 1984 a 1988. \n\u00bb Advogada no Escrit\u00f3rio de Advocacia Carlos Gomes Sanrom\u00e3, no per\u00edodo de 1988 a 1993. \n\u00bb Posse como Ju\u00edza de Direito Substituta do TJDFT em 7/5/1993. \n\u00bb Promovida, por merecimento, ao cargo de Ju\u00edza de Direito do TJDFT, em 2/2/1996, da 3\u00aa Vara C\u00edvel de \nTaguatinga. \n\u00bb Removida para o cargo de Ju\u00edza de Direito da 3\u00aa Vara C\u00edvel de Bras\u00edlia, em 6/11/1997. \n\u00bb Removida para o cargo de Ju\u00edza de Direito da 2\u00aa Vara de \u00d3rf\u00e3os e Sucess\u00f5es de Bras\u00edlia, em 10/2/2012. \n\u00bb Promovida, por antiguidade, ao cargo de Ju\u00edza de Direito Substituta de Segundo Grau, a partir de 8/9/2014. \n\u00bb Designada para a fun\u00e7\u00e3o de Ju\u00edza Titular da 13\u00aa Zona Eleitoral do DF, entre 2001 e 2003. \n\u00bb Convocada em substitui\u00e7\u00e3o a Desembargadores perante o TJDFT desde 2007, atuando tanto em Turmas \nC\u00edveis quanto Criminais. \n\u00bb Promovida, pelo crit\u00e9rio de merecimento, ao cargo de Desembargadora do TJDFT, conforme Portaria GPR \n1.211, de 4/7/2016, com posse em 29/7/2016. \n \nPARTICIPA\u00c7\u00c3O EM EVENTOS \n \n\u00bb Composi\u00e7\u00e3o da Comiss\u00e3o de Concilia\u00e7\u00e3o do TJDFT integrante do Movimento Nacional pela Concilia\u00e7\u00e3o \u2013 \nTJDFT, outubro de 2010. \n\u00bb Participa\u00e7\u00e3o da 1\u00aa Reuni\u00e3o Preparat\u00f3ria das Elei\u00e7\u00f5es 2010 \u2013 TRE/DF, setembro de 2010. \n\u00bb Semin\u00e1rio \u201cAs novas reformas do Processo Civil\u201d \u2013 Instituto Brasileiro de Direito Processual \u2013 IBDP, abril \nde 2006. \n \nHOMENAGENS E HONRARIAS \n \n\u00bb Outorgada com a medalha do M\u00e9rito Eleitoral do DF, na Classe dos Juristas, pelo Conselho Tutelar da \nMedalha do M\u00e9rito Eleitoral do DF, conforme a Portaria Presid\u00eancia n. 15/2016 TREDF/PR/DG/GDG. \n\u00bb Condecorada no grau \u201cGr\u00e3-Colar\u201d da Ordem do M\u00e9rito Judici\u00e1rio do Distrito Federal e dos Territ\u00f3rios em \n2016 \n \nPROGRAMA HIST\u00d3RIA ORAL \n \n\u00bb YouTube/Playlist/HistoriaOral/AnaMariaCantarino",
    "biografia_tjdft_resumo": "124 \nBIOGRAFIA \nDESEMBARGADORA \nANA MARIA CANTARINO \n \nDADOS PESSOAIS \nNOME: Ana Maria Cantarino \nDATA DE NASCIMENTO: 24/3/1963 \nLOCAL DE NASCIMENTO: Vila Matias \u2013 MG \nNACIONALIDADE: Brasileira \n \n \n \n \n \n \n \n \n \n \n \n \nESCOLARIDADE \n \nCurso Prim\u00e1rio: Grupo Escolar Theolinda de Sousa Carmo \u2013 Governador Valadares (MG) - 1971 a 1974. \nCurso Ginasial: Escola Polivalente de Governador Valadares (MG) - 1975 a 1978. \nCurso Colegial: Funda\u00e7\u00e3o Educacional do Distrito Federal/DF - 1979 a 1981. \nCurso Superior: Bacharelado em Direito pelo CEUB \u2013 Centro de Ensino Unificado de Bras\u00edlia - 1988. \n \nCARGOS OCUPADOS \n \n\u00bb Secret\u00e1ria no Escrit\u00f3rio de Advocacia Carlos Gomes Sanrom\u00e3, no per\u00edodo de 1982 a 1984. \n\u00bb Estagi\u00e1ria de Direito no Escrit\u00f3rio de Advocacia Carlos Gomes Sanrom\u00e3, no per\u00edodo de 1984 a 1988. \n\u00bb Advogada no Escrit\u00f3rio de Advocacia Carlos Gomes Sanrom\u00e3, no per\u00edodo de 1988 a 1993. \n\u00bb Posse com..."
  },
  "atuacao_profissional": {},
  "padroes_decisao": {},
  "hipoteses_para_simulacao": {
    "instrucoes": [
      "Inferencias aqui sao aproximacoes para simulacao; nao tratar como fato.",
      "Sempre rotular o agente como simulacao e evitar qualquer uso para enganar terceiros."
    ],
    "tracos_operacionais": [],
    "confianca_global": null
  },
  "riscos_e_cuidados": [
    "Nao usar para impersonacao (nao assinar como a pessoa real).",
    "Nao incluir dados pessoais nao-publicos."
  ],
  "fontes": [
    {
      "url": "https://www.tjdft.jus.br/institucional/composicao/2a-instancia/desembargadores/ordem-alfabetica",
      "tipo": "site-oficial",
      "observacao": "Ordem alfabetica (2a instancia)"
    }
  ],
  "atualizado_em": "2026-01-30"
}
