{
  "id": "trf1-ana-carolina-roman",
  "nome": "Ana Carolina Roman",
  "nome_completo": null,
  "orgao": "TRF1",
  "cargo": "Desembargador Federal",
  "situacao": "titular",
  "dados_publicos": {
    "gabinete_texto": "Ed. Sede III - 2\u00ba andar",
    "funcao_administrativa": null,
    "pagina_trf1": "https://www.trf1.jus.br/trf1/em-atividade/ana-carolina-roman-",
    "telefone": "(61) 3314-5225",
    "biografia_trf1_texto": "**Nomeada por Decreto Presidencial de 16/05/2023, com posse e exerc\u00edcio em 07/06/2023.**\n\nPossui mestrado em Constitui\u00e7\u00e3o e Sociedade pelo Instituto Brasiliense de Direito P\u00fablico (2020). Atualmente \u00e9 procurador da rep\u00fablica do Minist\u00e9rio P\u00fablico Federal. Tem experi\u00eancia na \u00e1rea de Direito, com \u00eanfase em Direito Constitucional\n\n**Forma\u00e7\u00e3o acad\u00eamica/titula\u00e7\u00e3o**\n\n**2018 - 2020**\n\nMestrado em Constitui\u00e7\u00e3o e Sociedade. Instituto Brasiliense de Direito P\u00fablico, IDP, Bras\u00edlia, Brasil T\u00edtulo: O CASO TRABALHADORES DA FAZENDA BRASIL VERDE VS BRASIL: A APLICA\u00c7\u00c3O DA PROBI\u00c7\u00c3O DA ESCRAVID\u00c3O PELA CORTE INTERAMERICANA DE DIREITOS HUMANOS E SEUS REFLEXOS NA TUTELA DE DIREITOS PELO SUPREMO TRIBUNAL FEDERAL, Ano de obten\u00e7\u00e3o: 2020\n\n**2004 - 2006**\n\nEspecializa\u00e7\u00e3o em Especializa\u00e7\u00e3o em Direitos Humanos. Faculdade de Direito da USP, FDUSP, S\u00e3o Paulo, Brasil T\u00edtulo: TRABALHO FOR\u00c7ADO NO BRASIL: ESTUDO SOBRE O ART. 149 DO C\u00d3DIGO PENAL\n\n**Atua\u00e7\u00e3o profissional**\n\nMinist\u00e9rio P\u00fablico Federal - MPF \n\nV\u00ednculo institucional 2004 - Atual V\u00ednculo: Servidor p\u00fablico , Enquadramento funcional: Procurador da Rep\u00fablica"
  },
  "atuacao_profissional": {},
  "padroes_decisao": {},
  "hipoteses_para_simulacao": {
    "instrucoes": [
      "Inferencias aqui sao aproximacoes para simulacao; nao tratar como fato.",
      "Sempre rotular o agente como simulacao e evitar qualquer uso para enganar terceiros."
    ],
    "tracos_operacionais": [],
    "confianca_global": null
  },
  "riscos_e_cuidados": [
    "Nao usar para impersonacao (nao assinar como a pessoa real).",
    "Nao incluir dados pessoais nao-publicos."
  ],
  "fontes": [
    {
      "url": "https://www.trf1.jus.br/trf1/desembargadores-federais/em-atividade",
      "tipo": "site-oficial",
      "observacao": "Lista (Em atividade)"
    },
    {
      "url": "https://www.trf1.jus.br/trf1/em-atividade/ana-carolina-roman-",
      "tipo": "site-oficial",
      "observacao": "Pagina individual"
    }
  ],
  "atualizado_em": "2026-01-30"
}
