{
  "id": "trf1-joao-luiz-de-sousa",
  "nome": "Jo\u00e3o Luiz de Sousa",
  "nome_completo": null,
  "orgao": "TRF1",
  "cargo": "Desembargador Federal",
  "situacao": "titular",
  "dados_publicos": {
    "gabinete_texto": "Ed. Sede I - 3\u00ba andar - Sala 6",
    "funcao_administrativa": null,
    "pagina_trf1": "https://www.trf1.jus.br/trf1/em-atividade/joao-luiz-de-sousa",
    "telefone": "(61) 3314-5225",
    "biografia_trf1_texto": "**Nomeado por Decreto Presidencial de 19/11/2014, com posse e exerc\u00edcio em 01/12/2014.**\n\nJo\u00e3o Luiz de Sousa, natural de Barueri, S\u00e3o Paulo, nascido em 9 de abril de 1955, casado, tomou posse no Tribunal Regional Federal da 1\u00aa Regi\u00e3o no dia primeiro de dezembro de 2014.\n\n#### Instru\u00e7\u00e3o\n\nP\u00f3s-Gradua\u00e7\u00e3o (Especializa\u00e7\u00e3o) Did\u00e1tica do Ensino Superior Universidade Cat\u00f3lica de Bras\u00edlia, 1994; \n\nDireito Tribut\u00e1rio, UniCeub - Centro Universit\u00e1rio de Bras\u00edlia - CESAPE, 1986 /1987;\n\nExtens\u00e3o Universit\u00e1ria, Introdu\u00e7\u00e3o \u00e0 Ci\u00eancia Pol\u00edtica, UNB - Universidade de Bras\u00edlia,1984;\n\nGradua\u00e7\u00e3o, Bacharel em Direito - Especializa\u00e7\u00e3o em Direito Privado, 1978/1981, UniDF - Centro de Ensino Universit\u00e1rio do Distrito Federal (ex-Associa\u00e7\u00e3o de Ensino Unificado do Distrito Federal - AEUDF).\n\nCurso de gradua\u00e7\u00e3o em Filosofia (inconcluso) - 1994, UCB - Universidade Cat\u00f3lica de Bras\u00edlia.\n\n#### Atividade Profissional\n\nJuiz Federal - Justi\u00e7a Federal do Distrito Federal (TRF-1a Regi\u00e3o). \n\nJuiz titular da 15a Vara da Se\u00e7\u00e3o Judici\u00e1ria do Distrito Federal. \n\nIngresso em 26.02.1988, como juiz titular da 2a Vara da Se\u00e7\u00e3o Judici\u00e1ria do Amazonas. \n\nRemovido em 05/1988 para a Vara \u00danica Ilh\u00e9us, BA. \n\nRemovido em 10/1993 para a 15a Vara do Distrito Federal. \n\nProfessor Universit\u00e1rio do UniDF - Centro Universit\u00e1rio do Distrito Federal (Ex-Associa\u00e7\u00e3o de Ensino Unificado Distrito Federal - AEUDF). 1\u00ba.03.1987 a 31.08.93. \n\nJuiz do Tribunal Regional Eleitoral do Amazonas - TRE/AM \n\nAtua\u00e7\u00e3o como juiz substituto, de mar\u00e7o a maio de 1988. \n\nJuiz Instrutor do 2\u00ba Curso de Prepara\u00e7\u00e3o de Magistrados Federais. \n\nN\u00facleo de Prepara\u00e7\u00e3o e Aperfei\u00e7oamento dos Magistrados Federais do TRF 1a Regi\u00e3o em junho de 1994. \n\nPromotor de Justi\u00e7a Substituto - Minist\u00e9rio P\u00fablico do Distrito Federal e Territ\u00f3rios em abril de 1985 a fevereiro de 1988. \n\nDesigna\u00e7\u00e3o especial do Procurador-Geral, para atuar como membro da Comiss\u00e3o Permanente de Defesa do Meio Ambiente, dos bens e direitos de valor art\u00edstico, est\u00e9tico, hist\u00f3rico, tur\u00edstico, paisag\u00edstico e do consumidor. \n\nDesigna\u00e7\u00e3o como membro da Comiss\u00e3o de Defesa junto ao Tribunal do J\u00fari Popular - 1986/1987. \n\nJuiz de Direito e Juiz Eleitoral. \n\nTribunal de Justi\u00e7a do Estado de Rond\u00f4nia. 1985. \n\nJuiz de Direito titular da Comarca de Ouro Preto do Oeste. Corregedor dos cart\u00f3rios judicial e extrajudiciais. \n\nDefensor P\u00fablico. \n\nMinist\u00e9rio P\u00fablico do Distrito Federal e Territ\u00f3rios. Junho/1984 a fevereiro /1985. \n\nCoordenador da Defensoria P\u00fablica de Taguatinga - DF. \n\nDiversas designa\u00e7\u00f5es do procurador-geral de Justi\u00e7a para atuar como curador de fam\u00edlia e curador de ausentes. \n\nAtua\u00e7\u00e3o tamb\u00e9m nas Defensorias das cidades-sat\u00e9lites do Gama e Brazl\u00e2ndia. \n\nEstagi\u00e1rio da Defensoria P\u00fablica do Minist\u00e9rio P\u00fablico do distrito Federal e Territ\u00f3rios,1980/1982.\n\n#### Semin\u00e1rios, Cursos e Palestras\n\nCurso de Qualifica\u00e7\u00e3o para Ju\u00edzes Federais \u2013 \u00c1rea Criminal. De 5 a 7 de maio de 2014. \n\nAJUFE \u2013 Associa\u00e7\u00e3o dos Ju\u00edzes Federais e Minist\u00e9rio da Aeron\u00e1utica \n\nDepartamento de Pol\u00edcia Federal e Academia de Pol\u00edcia Federal \n\nO Di\u00e1logo entre a Sa\u00fade e o Direito \n\nANVISA - De 20 a 22/11/2006 \n\nDesenvolvimento Brasileiro (curso de extens\u00e3o cultural). \n\nConv\u00edvio - Sociedade Brasileira de Cultura - Abril 1998. \n\nConstitui\u00e7\u00f5es do Brasil \n\nFunda\u00e7\u00e3o Friedri Naumann e Instituto Tancredo Neves - Fevereiro de 1987. \n\nMercado de Capitais \u2013 Semin\u00e1rios para a Magistratura e Minist\u00e9rio P\u00fablico \n\nComiss\u00e3o Nacional da Bolsa de Valores \u2013 Bras\u00edlia \u2013 DF - Setembro de 1985. \n\nDireito Processual Civil - 24 a 27.05.1982 \n\nCiclo de Estudos - Ordem dos Advogados do Brasil, Se\u00e7\u00e3o do D.F. \n\nDireito Tribut\u00e1rio - 01 a 04.06.1982 - Idem \n\nDireito Penal - 12 a 15.4.1982 - Idem \n\nDireito Empresarial - 18 a 21.10.1982 - Idem\n\n#### Condecora\u00e7\u00f5es\n\nComendador \u2013 Ordem do M\u00e9rito Judici\u00e1rio.\n\nOutorgada pelo Tribunal de Justi\u00e7a do Distrito Federal e Territ\u00f3rios. 10.05.2005.\n\nMedalha do Pacificador \n\nOutorgada pelo Minist\u00e9rio do Ex\u00e9rcito. 25.08.1995.\n\n#### Mo\u00e7\u00e3o de Agradecimento\n\nConcedida pela Funda\u00e7\u00e3o Biodiversitas para a Conserva\u00e7\u00e3o da Diversidade Biol\u00f3gica, entidade ligada \u00e0 WWF - World Wildlife Fund (USA). 28.09.1990 (Of. 28-90 DTC/FB)."
  },
  "atuacao_profissional": {},
  "padroes_decisao": {},
  "hipoteses_para_simulacao": {
    "instrucoes": [
      "Inferencias aqui sao aproximacoes para simulacao; nao tratar como fato.",
      "Sempre rotular o agente como simulacao e evitar qualquer uso para enganar terceiros."
    ],
    "tracos_operacionais": [],
    "confianca_global": null
  },
  "riscos_e_cuidados": [
    "Nao usar para impersonacao (nao assinar como a pessoa real).",
    "Nao incluir dados pessoais nao-publicos."
  ],
  "fontes": [
    {
      "url": "https://www.trf1.jus.br/trf1/desembargadores-federais/em-atividade",
      "tipo": "site-oficial",
      "observacao": "Lista (Em atividade)"
    },
    {
      "url": "https://www.trf1.jus.br/trf1/em-atividade/joao-luiz-de-sousa",
      "tipo": "site-oficial",
      "observacao": "Pagina individual"
    }
  ],
  "atualizado_em": "2026-01-30"
}
