{
  "id": "tjdft-carlos-pires-soares-neto",
  "nome": "Des. Carlos Pires Soares Neto",
  "nome_completo": null,
  "orgao": "TJDFT",
  "cargo": "Desembargador",
  "situacao": "titular",
  "dados_publicos": {
    "assessor": "Shirley Aparecida Lemos da Silva",
    "telefones_gabinete": "(61)3103-4253",
    "biografia_tjdft_url": "https://www.tjdft.jus.br/institucional/gestao-do-conhecimento/gestao-da-memoria/biografias/des-carlos-pires-soares-neto-2.pdf",
    "biografia_tjdft_texto": "138 \n \n \nBIOGRAFIA \nDESEMBARGADOR \nCARLOS PIRES \n \nDADOS PESSOAIS \nNOME: Carlos Pires Soares Neto \nDATA DE NASCIMENTO: 18/7/1963 \nLOCAL DE NASCIMENTO: Pariquera-A\u00e7u/SP \nNACIONALIDADE: Brasileira \n \n \n \n \n \n \n \n \n \n \nESCOLARIDADE \n \nCurso Superior: Graduado em Direito pela Universidade Mackenzie de S\u00e3o Paulo/SP, em 1988. \n \nEMPREGOS E CARGOS OCUPADOS \n \n\u00bb Juiz de Direito Substituto do Tribunal de Justi\u00e7a do Distrito Federal e dos Territ\u00f3rios em 15/4/1994. \n\u00bb Juiz de Direito deste TJDFT em 3/12/1996, tendo sido lotado no Tribunal do J\u00fari de Taguatinga. Em \n14.2.2002 foi removido para a 4\u00aa Vara de Entorpecentes e Contraven\u00e7\u00f5es Penais do DF, e, posteriormente, \nem 17.12.2009, para a 4\u00aa Vara Criminal de Bras\u00edlia. \n\u00bb Removido pelo crit\u00e9rio de antiguidade ao cargo de Juiz de Direito Substituto de Segundo Grau, conforme \nPortaria GPR 1.540 de 25/5/2016, com posse em 9/9/2016. \n\u00bb Designado pela Presid\u00eancia do TJDFT para atuar como Juiz de Direito Substituto de Segundo Grau na 1\u00aa \nTurma Criminal e C\u00e2mara Criminal. \n\u00bb Juiz Eleitoral. \n\u00bb Juiz de Turma Recursal. \n\u00bb Promovido, pelo crit\u00e9rio de merecimento, ao cargo de Desembargador do TJDFT, conforme Portaria \nGPR 1.011, de 7/6/2022, com posse em 8/7/2022. \n \nT\u00cdTULOS E HONRARIAS \n \n\u00bb Outorgado com a comenda da Ordem do M\u00e9rito Judici\u00e1rio do Distrito Federal e dos Territ\u00f3rios, constante \ndo Quadro Ordin\u00e1rio, Grau Gr\u00e3o-Colar, em 30/11/2021. \n \nPROGRAMA HIST\u00d3RIA ORAL \n \n\u00bbYouTube/Playlist/Hist\u00f3riaOral/CarlosPiresSoaresNeto",
    "biografia_tjdft_resumo": "138 \n \n \nBIOGRAFIA \nDESEMBARGADOR \nCARLOS PIRES \n \nDADOS PESSOAIS \nNOME: Carlos Pires Soares Neto \nDATA DE NASCIMENTO: 18/7/1963 \nLOCAL DE NASCIMENTO: Pariquera-A\u00e7u/SP \nNACIONALIDADE: Brasileira \n \n \n \n \n \n \n \n \n \n \nESCOLARIDADE \n \nCurso Superior: Graduado em Direito pela Universidade Mackenzie de S\u00e3o Paulo/SP, em 1988. \n \nEMPREGOS E CARGOS OCUPADOS \n \n\u00bb Juiz de Direito Substituto do Tribunal de Justi\u00e7a do Distrito Federal e dos Territ\u00f3rios em 15/4/1994. \n\u00bb Juiz de Direito deste TJDFT em 3/12/1996, tendo sido lotado no Tribunal do J\u00fari de Taguatinga. Em \n14.2.2002 foi removido para a 4\u00aa Vara de Entorpecentes e Contraven\u00e7\u00f5es Penais do DF, e, posteriormente, \nem 17.12.2009, para a 4\u00aa Vara Criminal de Bras\u00edlia. \n\u00bb Removido pelo crit\u00e9rio de antiguidade ao cargo de Juiz de Direito Substituto de Segundo Grau, conforme \nPortaria GPR 1.540 de 25/5/2016, com posse em 9/9/2016. \n\u00bb Designado pela P..."
  },
  "atuacao_profissional": {},
  "padroes_decisao": {},
  "hipoteses_para_simulacao": {
    "instrucoes": [
      "Inferencias aqui sao aproximacoes para simulacao; nao tratar como fato.",
      "Sempre rotular o agente como simulacao e evitar qualquer uso para enganar terceiros."
    ],
    "tracos_operacionais": [],
    "confianca_global": null
  },
  "riscos_e_cuidados": [
    "Nao usar para impersonacao (nao assinar como a pessoa real).",
    "Nao incluir dados pessoais nao-publicos."
  ],
  "fontes": [
    {
      "url": "https://www.tjdft.jus.br/institucional/composicao/2a-instancia/desembargadores/ordem-alfabetica",
      "tipo": "site-oficial",
      "observacao": "Ordem alfabetica (2a instancia)"
    }
  ],
  "atualizado_em": "2026-01-30"
}
