{
  "id": "trf1-roberto-carvalho-veloso",
  "nome": "Roberto Carvalho Veloso",
  "nome_completo": null,
  "orgao": "TRF1",
  "cargo": "Desembargador Federal",
  "situacao": "titular",
  "dados_publicos": {
    "gabinete_texto": "Ed. Sede II - 8\u00ba andar",
    "funcao_administrativa": null,
    "pagina_trf1": "https://www.trf1.jus.br/trf1/em-atividade/roberto-carvalho-veloso-",
    "telefone": "(61) 3314-5225",
    "biografia_trf1_texto": "**Nomeado por Decreto Presidencial de 27/04/2023, com posse e exerc\u00edcio em 10/05/2023.**\n\n**Roberto Carvalho Veloso**, nascido em Teresina (Piau\u00ed), no dia 25 de novembro de 1963, tomou posse no cargo de juiz federal em 24 de novembro de 1995 e no cargo de Desembargador Federal em 10 de maio de 2023 no Tribunal Regional Federal da 1\u00aa Regi\u00e3o.\n\n**Instru\u00e7\u00e3o**\n\n- Gradua\u00e7\u00e3o em Direito pela Universidade Federal do Piau\u00ed em 1987;\n\n- Mestre em Direito pela Universidade Federal de Pernambuco (com a disserta\u00e7\u00e3o \"A influ\u00eancia da teoria do consenso na justi\u00e7a penal, em 2002;\n\n- Doutor pela Universidade Federal de Pernambuco, com a tese \"A inexibilidade de conduta diversa e sua aplica\u00e7\u00e3o nos crimes contra a ordem tribut\u00e1ria\", em 2008.\n\n- P\u00f3s-doutor em direito penal tribut\u00e1rio pela Universidade Presbiteriana Mackenzie, em 2022.\n\n****\n\n**Atividade Profissional**\n\nDesembargador Federal do TRF1. Membro do Conselho Superior da Escola Nacional de Forma\u00e7\u00e3o e Aperfei\u00e7oamento de Magistrados /ENFAM,mandato de 2020 a 2024. Coordenador do Programa de P\u00f3s- Gradua\u00e7\u00e3o em Direito e Institui\u00e7\u00f5es do Sistema de Justi\u00e7a da UFMA. Membro do Conselho de Ensino Pesquisa e Extens\u00e3o da UFMA \u2013 CONSEPE.\n\nEx-presidente da AJUFE - Associa\u00e7\u00e3o dos Ju\u00edzes Federais do Brasil, gest\u00e3o 2016/2018. Ex-Presidente da Associa\u00e7\u00e3o dos Ju\u00edzes Federais da 1\u00aa Regi\u00e3o, gest\u00e3o 2010/2012. Professor do Curso de Direito da UNIEURO.Professor orientador de disserta\u00e7\u00f5es de Mestrado da Universidade Aut\u00f4noma de Lisboa - Portugal. Membro da Academia Maranhense de Letras Jur\u00eddicas. Membro Correspondente da Academia Grajauense de Letras e Artes. Exerceu as fun\u00e7\u00f5es de Promotor de Justi\u00e7a do Estado do Maranh\u00e3o, de Juiz Federal no Maranh\u00e3o, de Juiz Federal em Bras\u00edlia, de Juiz Federal no Piau\u00ed, de Juiz do Tribunal Regional Eleitoral do Piau\u00ed e do Maranh\u00e3o, de Juiz da Propaganda nas elei\u00e7\u00f5es de 1998 e de 2006 do Tribunal Regional Eleitoral do Maranh\u00e3o.\n\nFoi membro da Comiss\u00e3o de Juristas do Senado Federal encarregada de elaborar o novo C\u00f3digo Eleitoral. Exerceu o cargo de Diretor do Foro da Se\u00e7\u00e3o Judici\u00e1ria do Piau\u00ed,de Diretor do Foro da Se\u00e7\u00e3o Judici\u00e1ria do Maranh\u00e3o, de Coordenador do Curso de Especializa\u00e7\u00e3o em Direito Eleitoral da UFMA em conv\u00eanio com o TRE/MA e de Coordenador do Mestrado em Direito da UFMA, de 2018 a 2022. Foi o primeiro juiz das Varas Federais de Imperatriz/MA, Caxias/MA, 8\u00aa Vara de S\u00e3o Lu\u00eds/MA e 27\u00aa de Bras\u00edlia/DF.\n\nTem atua\u00e7\u00e3o na \u00e1rea de Direito Tribut\u00e1rio, Penal e Eleitoral. \u00c9 autor de v\u00e1rios artigos cient\u00edficos publicados em peri\u00f3dicos conceituados pela CAPES. Organizou e coordenou a publica\u00e7\u00e3o de diversos livros, a maioria oriunda das pesquisas da p\u00f3s-gradua\u00e7\u00e3o. \u00c9 autor e co-autor de v\u00e1rios livros.\n\n**Livros Publicados**\n\n- VELOSO, Roberto Carvalho; COSTA, Paulo Weyl Albuquerque (Org.) ;SIQUEIRA NETO, Jos\u00e9 Francisco (Org.) .**DIREITOS HUMANOS E DESENVOLVIMENTO.** 1. ed. S\u00e3o Lu\u00eds: EDUFMA, 2021. v. 1. 556p .\n\n- VELOSO, ROBERTO CARVALHO; DANIEL F N M (Org.) ; COSTA, Paulo Weyl Albuquerque (Org.) .**DIREITO E DESENVOLVIMENTO.** 1. ed. S\u00e3o Lu\u00eds:EdUFMA, 2020. v. 1. 400p .\n\n- VELOSO, Roberto Carvalho; LIMA, Marcelo de Carvalho (Org.) ; TEIXEIRA, M.A. C. (Org.) ; MOREIRA, Eduardo Jos\u00e9 Leal(Org.) .**DIREITO ELEITORAL E DEMOCRACIA**: Estudos em homenagem ao Desembargador Cleones Carvalho Cunha. 1. ed.S\u00e3o Lu\u00eds: EDUFMA, 2020. v. 1. 970p .\n\n- VELOSO, ROBERTO CARVALHO; COSTA, Paulo Weyl Albuquerque (Org.) ;SIQUEIRA NETO, Jos\u00e9 Francisco (Org.).**DIREITO & DESENVOLVIMENTO NA AMAZ\u00d4NIA.** 1. ed. S\u00e3o Lu\u00eds: EDUFMA, 2020. v. 1. 584p\n\n- VELOSO, ROBERTO CARVALHO; GUIMARAES, Cl\u00e1udio Alberto Gabriel. (Org.) ;SANTANA, Jos\u00e9 Cl\u00e1udio Pav\u00e3o (Org.) ;RAMOS, Edith Maria Barbosa (Org.) ;SILVA, Artenira da Silva (Org.) ; MATTOS, D. (Org.) ; MATOS, Nelson Juliano Cardoso(Org.) ; RAMOS, Newton Pereira (Org.) ; BONATO, Giovani (Org.) ;PEREIRA, Paulo Velten Silva (Org.) ; PESSOA, Robert\u00f4nioSantos (Org.) ;MADUREIRA, A. S. (Org.) ; SENA, J. P. (Org.) .**A DIN\u00c2MICA DO DIREITO DO ESTADO NO MUNDOGLOBALIZADO.** 1. ed. S\u00e3o Lu\u00eds: EDUFMA, 2019. v. 1.756p\n\n- VELOSO, Roberto Carvalho; PIMENTA, Clara Mota (Org.) ; SUXBERGER,Rejane Jungbluth (Org.) ; RIBEIRO, MonicaThais Souza (Org.) ; CRUZ, Adriana Alves dos Santos (Org.) ; ALVIM, Alcioni Escobar da Costa (Org.) ; PASSOS,KennyaRegyna Mesquita (Org.) ; SEIXAS, Gilda Maria Sigmaringa (Org.) ;SENNA, Carina C\u00e1tia Bastos de (Org.) .**MAGISTRATURA E EQUIDADE**. 1. ed.Belo Horizonte: Editora D \u00b4Pl\u00e1cido, 2018. v. 1. 294p .\n\n- VELOSO, Roberto Carvalho; Bochenek, Antonio C\u00e9sar (Org.) ; HORTA, B. T. L.(Org.) .**JUSTI\u00c7A FEDERAL: ESTUDOS DOUTRIN\u00c1RIOS EM HOMENAGEM AOS 45 ANOS DA AJUFE.** 1. ed. Belo Horizonte: Editora D \u00b4Pl\u00e1cido, 2017. 361p\n\n- VELOSO, Roberto Carvalho; FONSECA, Reynaldo Soares da. (Org.) .**JUSTI\u00c7A FEDERAL: Estudos em homenagem ao desembargador federal Leomar Amorim.** 1. ed. Belo Horizonte: D'Pl\u00e1cido, 2016. v. 1. 826p\n\n- VELOSO, Roberto Carvalho; SANTOS, F. J. C. (Org.) ; BENICIO, F. C. C. G.(Org.) ; BRAND\u00c3O, KARLA CORR\u00caA SANTOS(Org.) ; CRUZ, R. L. E. (Org.) .**TEMAS DE DIREITO ELEITORAL**. 1. ed. S\u00c3O LU\u00cdS: EDUFMA, 2016. v. 1. 476p\n\n- VELOSO, Roberto Carvalho; RAMOS, Edith Maria Barbosa (Org.) ; LIMA,Viviane Freitas Perdig\u00e3o (Org.) ; CAMARAO,Felipe Costa (Org.) ; PACH\u00caCO,Symone D'alma Ferreira (Org.) ; SENA, J. P. (Org.) ; MADUREIRA, A. S. (Org.) ;OLIVEIRA, I.S. J. F. (Org.) .**DIREITO E INSTITUI\u00c7\u00d5ES: TEMAS CONTEMPOR\u00c2NEOS.**1. ed. S\u00e3o Lu\u00eds: EDUFMA, 2016. v. 1. 439p\n\n- VELOSO, Roberto Carvalho. CRIMES TRIBUT\u00c1RIOS. 1. ed. S\u00e3o Paulo:Quartier Latin, 2011. v. 1. 288p."
  },
  "atuacao_profissional": {},
  "padroes_decisao": {},
  "hipoteses_para_simulacao": {
    "instrucoes": [
      "Inferencias aqui sao aproximacoes para simulacao; nao tratar como fato.",
      "Sempre rotular o agente como simulacao e evitar qualquer uso para enganar terceiros."
    ],
    "tracos_operacionais": [],
    "confianca_global": null
  },
  "riscos_e_cuidados": [
    "Nao usar para impersonacao (nao assinar como a pessoa real).",
    "Nao incluir dados pessoais nao-publicos."
  ],
  "fontes": [
    {
      "url": "https://www.trf1.jus.br/trf1/desembargadores-federais/em-atividade",
      "tipo": "site-oficial",
      "observacao": "Lista (Em atividade)"
    },
    {
      "url": "https://www.trf1.jus.br/trf1/em-atividade/roberto-carvalho-veloso-",
      "tipo": "site-oficial",
      "observacao": "Pagina individual"
    }
  ],
  "atualizado_em": "2026-01-30"
}
