{
  "id": "tjdft-diva-lucy-de-faria-pereira",
  "nome": "Desa. Diva Lucy de Faria Pereira",
  "nome_completo": null,
  "orgao": "TJDFT",
  "cargo": "Desembargador",
  "situacao": "titular",
  "dados_publicos": {
    "assessor": "Neuma Durmont de Souza",
    "telefones_gabinete": "(61)3103-6183, (61)3103-6187, (61)3103-6185, (61)3103-6186, (61)3103-6184",
    "biografia_tjdft_url": "https://www.tjdft.jus.br/institucional/gestao-do-conhecimento/gestao-da-memoria/biografias/desa-diva-lucy-de-faria-pereira.pdf",
    "biografia_tjdft_texto": "132 \n \n \nBIOGRAFIA \nDESEMBARGADOR \nDIVA LUCY \n \nDADOS PESSOAIS \nNOME: Diva Lucy de Faria Pereira \nDATA DE NASCIMENTO: 18/3/1963 \nLOCAL DE NASCIMENTO: An\u00e1polis \u2013 GO \nNACIONALIDADE: rasileira \n \n \n \n \n \n \n \n \nESCOLARIDADE \n \nCurso Superior: Bacharel em Direito pela Universidade de Bras\u00edlia - UnB, em 1985. \nP\u00f3s-Gradua\u00e7\u00e3o: Lato Sensu em Direito Constitucional no Instituto Brasiliense de Direito P\u00fablico IDP, em \n2012. \n \n \nCARGOS OCUPADOS \n \n\u00bb Assessora da Procuradoria Geral do Distrito Federal, de 31/1/1986 a 14/5/1989. \n\u00bb Atividades de assist\u00eancia a pessoas punidas por atos de exce\u00e7\u00e3o ou por motivos pol\u00edticos, para cujo \ndesempenho foi credenciada pela Portaria PGR n.\u00ba 11, de 22 de setembro de 1986, do Excelent\u00edssimo Senhor \nProcurador Geral do Distrito Federal, Doutor Humberto Gomes de Barros. \n\u00bb Promotora de Justi\u00e7a do MPDFT, de 15/05/1989 a 14/4/1994. \n\u00bb Posse como Ju\u00edza de Direito Substituta do TJDFT em 15/4/1994. \n\u00bb Promovida, por merecimento, para o cargo de Ju\u00edza de Direito em 2/2/1996. \n\u00bb Atuou como Ju\u00edza Eleitoral da 13\u00aa Zona Eleitoral TRE-DF em 2000. \n\u00bb Promovida para o cargo de Ju\u00edza de Direito Substituta de Segundo Grau do TJDFT em 21/2/2020. \n\u00bb Desembargadora Eleitoral Substituta do TRE-DF de 2017 a 2019. \n\u00bb Desembargadora Eleitoral Titular do TRE-DF de 2019 a 2021. \n\u00bb Designada para compor, como Presidente, o Comit\u00ea Gestor Regional de Aten\u00e7\u00e3o Priorit\u00e1ria ao Primeiro \nGrau de Jurisdi\u00e7\u00e3o no \u00e2mbito do Tribunal Regional Eleitoral do Distrito Federal, em 25 de abril de 2019 \n(Portaria Presid\u00eancia \u2013TRE/DF n. 68/2019). \n\u00bb Designada para exercer a fun\u00e7\u00e3o de Ouvidora Regional Eleitoral do Distrito Federal, conforme Portaria \nPresid\u00eancia n. 167/2020 TER-DF/PG/GPR, em 3/8/2020. \n\u00bb Promovida, pelo crit\u00e9rio de antiguidade, ao cargo de Desembargadora do TJDFT, com posse em 12/3/2021. \n \nOUTROS T\u00cdTULOS \n \n\u00bb Vencedora do \u201cConcurso de Monografia Jur\u00eddica San Thiago Dantas\u201d promovido pelo Governo do Distrito \nFederal, com o tema: \u201cParcelamento do Solo no Distrito Federal\u201d. \n\u00bb Outorgada a Medalha do M\u00e9rito Eleitoral pelo Tribunal Regional Eleitoral do Distrito Federal TRE/DF, na \nClasse dos Juristas, em 2018. \n\u00bb Condecorada com a Comenda da Ordem do M\u00e9rito Judici\u00e1rio do Distrito Federal e dos Territ\u00f3rios \u2013 \nOMDFT \u2013, grau Gr\u00e3o-Colar, em 12/3/2021. \n \nPROGRAMA HIST\u00d3RIA ORAL \n \n\u00bb YouTube/Playlist/Hist\u00f3riaOral/DivaLucydeFariaPereira",
    "biografia_tjdft_resumo": "132 \n \n \nBIOGRAFIA \nDESEMBARGADOR \nDIVA LUCY \n \nDADOS PESSOAIS \nNOME: Diva Lucy de Faria Pereira \nDATA DE NASCIMENTO: 18/3/1963 \nLOCAL DE NASCIMENTO: An\u00e1polis \u2013 GO \nNACIONALIDADE: rasileira \n \n \n \n \n \n \n \n \nESCOLARIDADE \n \nCurso Superior: Bacharel em Direito pela Universidade de Bras\u00edlia - UnB, em 1985. \nP\u00f3s-Gradua\u00e7\u00e3o: Lato Sensu em Direito Constitucional no Instituto Brasiliense de Direito P\u00fablico IDP, em \n2012. \n \n \nCARGOS OCUPADOS \n \n\u00bb Assessora da Procuradoria Geral do Distrito Federal, de 31/1/1986 a 14/5/1989. \n\u00bb Atividades de assist\u00eancia a pessoas punidas por atos de exce\u00e7\u00e3o ou por motivos pol\u00edticos, para cujo \ndesempenho foi credenciada pela Portaria PGR n.\u00ba 11, de 22 de setembro de 1986, do Excelent\u00edssimo Senhor \nProcurador Geral do Distrito Federal, Doutor Humberto Gomes de Barros. \n\u00bb Promotora de Justi\u00e7a do MPDFT, de 15/05/1989 a 14/4/1994. \n\u00bb Posse como Ju\u00edza de Direito Subst..."
  },
  "atuacao_profissional": {},
  "padroes_decisao": {},
  "hipoteses_para_simulacao": {
    "instrucoes": [
      "Inferencias aqui sao aproximacoes para simulacao; nao tratar como fato.",
      "Sempre rotular o agente como simulacao e evitar qualquer uso para enganar terceiros."
    ],
    "tracos_operacionais": [],
    "confianca_global": null
  },
  "riscos_e_cuidados": [
    "Nao usar para impersonacao (nao assinar como a pessoa real).",
    "Nao incluir dados pessoais nao-publicos."
  ],
  "fontes": [
    {
      "url": "https://www.tjdft.jus.br/institucional/composicao/2a-instancia/desembargadores/ordem-alfabetica",
      "tipo": "site-oficial",
      "observacao": "Ordem alfabetica (2a instancia)"
    }
  ],
  "atualizado_em": "2026-01-30"
}
