{
  "id": "tjdft-maria-de-lourdes-abreu",
  "nome": "Desa. Maria de Lourdes Abreu",
  "nome_completo": null,
  "orgao": "TJDFT",
  "cargo": "Desembargador",
  "situacao": "titular",
  "dados_publicos": {
    "assessor": "Liamar Pires Martins",
    "telefones_gabinete": "(61)3103-5071, (61)3103-5077, (61)3103-5078, (61)3103-5096, (61)99334-3727",
    "biografia_tjdft_url": "https://www.tjdft.jus.br/institucional/gestao-do-conhecimento/gestao-da-memoria/biografias/desembargadora-maria-de-lourdes-abreu",
    "biografia_tjdft_texto": "116 \nBIOGRAFIA \nDESEMBARGADOR \nMARIA DE LOURDES \n \nDADOS PESSOAIS \nNOME: Maria de Lourdes Abreu \nDATA DE NASCIMENTO: 11/2/1953 \nLOCAL DE NASCIMENTO: Goi\u00e2nia \u2013 GO \nNACIONALIDADE: brasileira \n \n \n \n \n \n \n \n \n \n \n \n \nESCOLARIDADE \n \nEnsino Fundamental: Col\u00e9gio Salesiano Santa Clara \u2013 Goi\u00e2nia, 1963. \nEnsino M\u00e9dio: Col\u00e9gio Salesiano Santa Clara \u2013 Goi\u00e2nia, 1971. \nEnsino Superior: Universidade Federal de Goi\u00e1s, 1976. \nP\u00f3s-gradua\u00e7\u00e3o: Direito Processual Civil e Processual Penal pela Associa\u00e7\u00e3o de Ensino Unificado do Distrito \nFederal \u2013 AEUDF, 1984. \n \nCARGOS OCUPADOS \n \n\u00bb Nomeado Defensora P\u00fablica, ap\u00f3s aprova\u00e7\u00e3o no 7\u00ba Concurso P\u00fablico para o Minist\u00e9rio P\u00fablico do Distrito \nFederal e dos Territ\u00f3rios concurso p\u00fablico, com posse em 10/2/1981. \n\u00bb Promovida por antiguidade ao cargo de Promotora de Justi\u00e7a Substituta, em 5/4/1984. \n\u00bb Eleita Diretora da Associa\u00e7\u00e3o do Minist\u00e9rio P\u00fablico do Distrito Federal e dos Territ\u00f3rios, de 1988 a 1989. \n\u00bb Designada Diretora da Funda\u00e7\u00e3o Superior do MPDFT, da qual tamb\u00e9m foi fundadora, para o cargo de \n\u2018Ensino e Pesquisa\u2019, com mandato de 1990/1993. \n\u00bb Promovida por merecimento ao cargo de Procuradora de Justi\u00e7a, em 6/6/1994. \n\u00bb Designada para integrar como secret\u00e1ria a Comiss\u00e3o respons\u00e1vel do \u201c17\u00ba/18\u00ba Concurso para Promotor de \nJusti\u00e7a do MPDFT\u201d, conforme ata da 22\u00aa Sess\u00e3o Extraordin\u00e1ria do CSMPDFT de 7/10/1994. \n\u00bb Designada Assessora Especial do Minist\u00e9rio de Estado do Desenvolvimento, Ind\u00fastria e Com\u00e9rcio Exterior, \nde setembro de 1999 a maio de 2000. \n\u00bb Designada para integrar como secret\u00e1ria a Comiss\u00e3o respons\u00e1vel do \u201c24\u00ba/26\u00ba/27\u00ba/28\u00ba Concurso para \nPromotor de Justi\u00e7a do MPDFT\u201d, conforme Portarias PGJ publicadas em 17/1/2002; 17/9/2003; 17/1/2005 e \n4/3/2009, respectivamente. \n\u00bb Nomeada para o cargo de Conselheira do Conselho Superior e Col\u00e9gio de Procuradores e Promotores do \nMPDFT, nos seguintes per\u00edodos: 1993; 2000/2001/2004/2005; 2005/2006; 2008/2009; 2009/2010 e \n2014/2015. \n\u00bb Designada para o cargo de Secret\u00e1ria- Executiva do Conselho Nacional de Procuradores -Gerais do \nMinist\u00e9rio P\u00fablico da Uni\u00e3o e dos Estados \u2013 CNPG, 2014. \n\u00bb Designada Conselheira-Presidente do Conselho Curador da Funda\u00e7\u00e3o Escola Superior do MPDFT para o \nbi\u00eanio 2015/2016. \n\u00bb Antes de ser escolhida para o cargo de Desembargadora do TJDFT, coordenava a 3\u00aa C\u00e2mara de Coordena\u00e7\u00e3o \ne Revis\u00e3o da Ordem Jur\u00eddica na mat\u00e9ria do Meio Ambiente, Ordem Urban\u00edstica, Patrim\u00f4nio Cultural e \nHist\u00f3rico, al\u00e9m de atuar na 16\u00aa Procuradoria de Justi\u00e7a C\u00edvel Especializada em Meio Ambiente e a Comiss\u00e3o \nde Aperfei\u00e7oamento de Membros \u2013 CAM/MPDFT. \n\u00bb Nomeada pela Presidenta da Rep\u00fablica, Dilma Rousseff, para ocupar o cargo de Desembargadora do TJDFT \nem vaga destinada ao Minist\u00e9rio P\u00fablico do Distrito Federal e dos Territ\u00f3rios, a partir de 20/11/2014. \n\u00bb Eleita para o cargo de Ouvidor -Geral do TJDFT, para a gest\u00e3o 2024-2026, em 21/5/2024, com posse em \n11/6/2024, conforme Portaria GPR 1.366/2024. \n \n \nHOMENAGENS E ELOGIOS \n \n\u00bb Outorgada com a Comenda da Ordem do M\u00e9rito Judici\u00e1rio do Distrito Federal e dos Territ\u00f3rios \u2013 OMDFT, \nGrau Gr\u00e3o-Colar, conforme Portaria OMJDFT 4 de 12/12/2014. \n\u00bb Agraciada com a Medalha do M\u00e9rito Eleitoral do Distrito Federal, em grau de Comenda, em 6/4/2016. \n\u00bb Condecorada com a Ordem do M\u00e9rito do Minist\u00e9rio P\u00fablico Militar \u2013 OMMPM, em grau Gr\u00e3-Cruz, pelos \nservi\u00e7os prestados ao pa\u00eds e \u00e0 institui\u00e7\u00e3o, em 9/11/2016. \n\u00bb Condecorada com a Medalha Amigo da Marinha, pelo Comando do 7\u00ba Distrito Naval, sede em Bras\u00edlia-DF, \nem 6/11/2017. \n\u00bbElogiada pelo Procurador-Geral de Justi\u00e7a pelos servi\u00e7os prestados com corre\u00e7\u00e3o e efici\u00eancia, em 15/4/1982. \n\u00bb Elogiada pelos Procuradores-Gerais pela dedica\u00e7\u00e3o e efici\u00eancia em todos os concursos para membros da \u00bb\n \ndo MP, nos quais atuou como Secret\u00e1ria. \n\u00bb Elogiada pela Procuradora-Geral de Justi\u00e7a pela dedica\u00e7\u00e3o e seriedade desempenhadas durante o mandato \nde Conselheira do Egr\u00e9gio Conselho Superior do MPDFT. \n\u00bb Elogiada pelo empenho e dedica\u00e7\u00e3o no trabalho desempenhado frente \u00e0 Secretaria do Conselho Nacional \nde Procuradores-Gerais de Justi\u00e7a (CNPG).",
    "biografia_tjdft_resumo": "116 \nBIOGRAFIA \nDESEMBARGADOR \nMARIA DE LOURDES \n \nDADOS PESSOAIS \nNOME: Maria de Lourdes Abreu \nDATA DE NASCIMENTO: 11/2/1953 \nLOCAL DE NASCIMENTO: Goi\u00e2nia \u2013 GO \nNACIONALIDADE: brasileira \n \n \n \n \n \n \n \n \n \n \n \n \nESCOLARIDADE \n \nEnsino Fundamental: Col\u00e9gio Salesiano Santa Clara \u2013 Goi\u00e2nia, 1963. \nEnsino M\u00e9dio: Col\u00e9gio Salesiano Santa Clara \u2013 Goi\u00e2nia, 1971. \nEnsino Superior: Universidade Federal de Goi\u00e1s, 1976. \nP\u00f3s-gradua\u00e7\u00e3o: Direito Processual Civil e Processual Penal pela Associa\u00e7\u00e3o de Ensino Unificado do Distrito \nFederal \u2013 AEUDF, 1984. \n \nCARGOS OCUPADOS \n \n\u00bb Nomeado Defensora P\u00fablica, ap\u00f3s aprova\u00e7\u00e3o no 7\u00ba Concurso P\u00fablico para o Minist\u00e9rio P\u00fablico do Distrito \nFederal e dos Territ\u00f3rios concurso p\u00fablico, com posse em 10/2/1981. \n\u00bb Promovida por antiguidade ao cargo de Promotora de Justi\u00e7a Substituta, em 5/4/1984. \n\u00bb Eleita Diretora da Associa\u00e7\u00e3o do Minist\u00e9rio P\u00fablico do Distrito Fede..."
  },
  "atuacao_profissional": {},
  "padroes_decisao": {},
  "hipoteses_para_simulacao": {
    "instrucoes": [
      "Inferencias aqui sao aproximacoes para simulacao; nao tratar como fato.",
      "Sempre rotular o agente como simulacao e evitar qualquer uso para enganar terceiros."
    ],
    "tracos_operacionais": [],
    "confianca_global": null
  },
  "riscos_e_cuidados": [
    "Nao usar para impersonacao (nao assinar como a pessoa real).",
    "Nao incluir dados pessoais nao-publicos."
  ],
  "fontes": [
    {
      "url": "https://www.tjdft.jus.br/institucional/composicao/2a-instancia/desembargadores/ordem-alfabetica",
      "tipo": "site-oficial",
      "observacao": "Ordem alfabetica (2a instancia)"
    }
  ],
  "atualizado_em": "2026-01-30"
}
