{
  "id": "tjdft-maria-de-fatima-rafael-de-aguiar",
  "nome": "Desa. Maria de F\u00e1tima Rafael de Aguiar",
  "nome_completo": null,
  "orgao": "TJDFT",
  "cargo": "Desembargador",
  "situacao": "titular",
  "dados_publicos": {
    "assessor": "Alessandra Leal Silva Brandao",
    "telefones_gabinete": "(61)3103-5050, (61)3103-5047, (61)93351540",
    "biografia_tjdft_url": "https://www.tjdft.jus.br/institucional/gestao-do-conhecimento/gestao-da-memoria/biografias/desembargadora-maria-de-fatima-rafael-de-aguiar",
    "biografia_tjdft_texto": "115 \nBIOGRAFIA \nDESEMBARGADORA \nMARIA DE F\u00c1TIMA \n \nDADOS PESSOAIS \nNOME: Maria de F\u00e1tima Rafael de Aguiar \nDATA DE NASCIMENTO: 15/4/1956 \nLOCAL DE NASCIMENTO: Goi\u00e2nia \u2013 GO \nNACIONALIDADE: brasileira \n \n \n \n \n \n \n \n \n \n \n \n \nESCOLARIDADE \n \nEnsino Superior: Bacharel em Direito pela Universidade de Bras\u00edlia \u2013 UnB, em 1979. \nP\u00f3s-gradua\u00e7\u00e3o: Processo Civil pelo Centro Universit\u00e1rio do Distrito Federal \u2013 UDF. \n \nEMPREGOS E CARGOS OCUPADOS \n \n\u00bb Advogada da Organiza\u00e7\u00e3o das Cooperativas Brasileiras \u2013 OCB, com exerc\u00edcio no Instituto Nacional de \nColoniza\u00e7\u00e3o e Reforma Agr\u00e1ria \u2013 INCRA. \n\u00bb Designada para fun\u00e7\u00e3o de chefia da Se\u00e7\u00e3o de Legisla\u00e7\u00e3o de Pessoal do TJDFT, conforme Portaria 273 de \n27/6/1983, ocupando o cargo de 1983 a 1987. \n\u00bb Nomeada para fun\u00e7\u00e3o de Diretora de Secretaria da 6\u00aa Vara Criminal da Circunscri\u00e7\u00e3o Judici\u00e1ria de Bras\u00edlia, \nconforme Portaria GPR 24 de 26/1/1987. \n\u00bb Aprovada no XVIII concurso para Magistratura do DF para o cargo de Juiz de Direito Substituto do Tribunal \nde Justi\u00e7a do Distrito Federal e dos Territ\u00f3rios (TJDFT), em 12/6/1992. \n\u00bb Designada para a fun\u00e7\u00e3o de Assistente da Presid\u00eancia, conforme Portaria GPR 239 de 18/5/1994. \n\u00bb Designada respons\u00e1vel pelo Servi\u00e7o de Distribui\u00e7\u00e3o da Circunscri\u00e7\u00e3o Judici\u00e1ria de Bras\u00edlia, conforme \nPortaria GPR 66 de 2/8/1994. \n\u00bb Promovida ao cargo de Juiz de Direito da Justi\u00e7a do DF, em 2/2/1996, assumindo a 1\u00aa Vara C\u00edvel do Parano\u00e1, \nsegundo Portaria GPR 34 de 17/1/1996. \n\u00bb Designada para Diretoria do F\u00f3rum do Parano\u00e1, conforme Portaria GC 28 de 1\u00ba/2/1996. \n\u00bb Ju\u00edza de Direito nas seguintes Varas da Justi\u00e7a do DF: 6\u00aa Vara Criminal (1992 -1996); 11\u00aa Vara C\u00edvel de \nBras\u00edlia (1996-2002) e 1\u00aa Vara de Precat\u00f3rias de Bras\u00edlia (2010-2013). \n\u00bb Nomeada Membro Suplente da 1\u00aa Turma Recursal dos Juizados Especiais C\u00edveis e Criminais do Distrito \nFederal, conforme Portaria GPR 261 de 6/6/2001. \n\u00bb Nomeada para a fun\u00e7\u00e3o de Assistente do Corregedor de Justi\u00e7a, conforme Portaria GPR 347 de 3 de maio \nde 2006. \n\u00bb Designada para Diretoria do F\u00f3rum J\u00falio Fabrini Mirabete, de julho de 2011 a julho de 2012, conforme \nPortaria GC 61 de 8/7/2011; Reconduzida ao cargo, por mais um ano, conforme Portaria GC 92 de 23/7/2012. \n\u00bb Convocada para compor o Tribunal Regional Eleitoral do DF para as Elei\u00e7\u00f5es 2010, conforme Portaria \nGP/TRE 300 de 30/9/2010. \n\u00bb Eleita Membro Titular do Tribunal Regional Eleitoral para os anos de 2012 e 2013, conforme Ata da 23\u00aa \nSess\u00e3o Administrativa do TRE-DF. \n\u00bb Removida pelo crit\u00e9rio de antiguidade ao cargo de Juiz de Direito Substituto de Segundo Grau, com posse \nem 20/5/2013, conforme Portaria GPR 613 de 10/5/2013. \n\u00bb Designada pela Presid\u00eancia do TJDFT para atuar como Juiz de Direito Substituto de Segundo Grau na 2\u00aa \nTurma C\u00edvel. \n\u00bb Promovida ao cargo de Desembargadora do TJDFT, por antiguidade, conforme Portaria GPR 1 .578 de \n22/9/2014. \n \nCURSOS \n \n\u00bb Direito Agr\u00e1rio pela Universidade Federal de Goi\u00e1s, de 16 a 20/5/1977. \n\u00bb Semana de Estudos Penais, Instituto Brasileiro de Ci\u00eancias Penais, 18 a 26/11/1976. \n\u00bb Direito Processual Civil pela Universidade Cat\u00f3lica de Goi\u00e1s, em 13/8/1976. \n\u00bb Responsabilidade Civil, de 31/2005 a 1\u00ba/6/2012. \n\u00bb T\u00edtulos de Cr\u00e9dito, de 1\u00ba a 2/3/2013. \n \nPARTICIPA\u00c7\u00c3O EM PALESTRAS \n \n\u00bb Direito Processual Civil na Universidade Federal de Goi\u00e1s, em 13/8/1976. \n\u00bb Legisla\u00e7\u00e3o de Pessoal no TJDFT, em 12/4/1985. \n\u00bb Legisla\u00e7\u00e3o Previdenci\u00e1ria no Minist\u00e9rio da Previd\u00eancia e Assist\u00eancia Social \u2013 MPAS, em 5/5/1986. \n \nPARTICIPA\u00c7\u00c3O EM F\u00d3RUNS JUR\u00cdDICOS \n \n\u00bb XLVI ENCONGE \u2013 Encontro Nacional do Col\u00e9gio de Corregedores Gerais, Aracaj\u00fa, Sergipe, de 21 a \n23/11/2007. \n \nHOMENAGENS E HONRARIAS \n \n\u00bb Agraciada com a comenda da Ordem do M\u00e9rito Judici\u00e1rio do Distrito Federal e dos Territ\u00f3rios, no grau de \n\u201cComendador\u201d, pelo Conselho Tutelar da referida ordem, conforme Portaria da OMJDFT 1 de 11/3/2005. \n\u00bb Agraciada com a medalha do M\u00e9rito Eleitoral do TRE -DF, na classe \u201cJurista\u201d, pelo Conselho Tutelar da \nreferida ordem.",
    "biografia_tjdft_resumo": "115 \nBIOGRAFIA \nDESEMBARGADORA \nMARIA DE F\u00c1TIMA \n \nDADOS PESSOAIS \nNOME: Maria de F\u00e1tima Rafael de Aguiar \nDATA DE NASCIMENTO: 15/4/1956 \nLOCAL DE NASCIMENTO: Goi\u00e2nia \u2013 GO \nNACIONALIDADE: brasileira \n \n \n \n \n \n \n \n \n \n \n \n \nESCOLARIDADE \n \nEnsino Superior: Bacharel em Direito pela Universidade de Bras\u00edlia \u2013 UnB, em 1979. \nP\u00f3s-gradua\u00e7\u00e3o: Processo Civil pelo Centro Universit\u00e1rio do Distrito Federal \u2013 UDF. \n \nEMPREGOS E CARGOS OCUPADOS \n \n\u00bb Advogada da Organiza\u00e7\u00e3o das Cooperativas Brasileiras \u2013 OCB, com exerc\u00edcio no Instituto Nacional de \nColoniza\u00e7\u00e3o e Reforma Agr\u00e1ria \u2013 INCRA. \n\u00bb Designada para fun\u00e7\u00e3o de chefia da Se\u00e7\u00e3o de Legisla\u00e7\u00e3o de Pessoal do TJDFT, conforme Portaria 273 de \n27/6/1983, ocupando o cargo de 1983 a 1987. \n\u00bb Nomeada para fun\u00e7\u00e3o de Diretora de Secretaria da 6\u00aa Vara Criminal da Circunscri\u00e7\u00e3o Judici\u00e1ria de Bras\u00edlia, \nconforme Portaria GPR 24 de 26/1/1987. \n\u00bb Aprovada no XVIII..."
  },
  "atuacao_profissional": {},
  "padroes_decisao": {},
  "hipoteses_para_simulacao": {
    "instrucoes": [
      "Inferencias aqui sao aproximacoes para simulacao; nao tratar como fato.",
      "Sempre rotular o agente como simulacao e evitar qualquer uso para enganar terceiros."
    ],
    "tracos_operacionais": [],
    "confianca_global": null
  },
  "riscos_e_cuidados": [
    "Nao usar para impersonacao (nao assinar como a pessoa real).",
    "Nao incluir dados pessoais nao-publicos."
  ],
  "fontes": [
    {
      "url": "https://www.tjdft.jus.br/institucional/composicao/2a-instancia/desembargadores/ordem-alfabetica",
      "tipo": "site-oficial",
      "observacao": "Ordem alfabetica (2a instancia)"
    }
  ],
  "atualizado_em": "2026-01-30"
}
