{
  "id": "trf1-maura-moraes-tayer",
  "nome": "Maura Moraes Tayer",
  "nome_completo": null,
  "orgao": "TRF1",
  "cargo": "Desembargador Federal",
  "situacao": "titular",
  "dados_publicos": {
    "gabinete_texto": "Ed. Sede I - 3\u00ba andar - Sala 14",
    "funcao_administrativa": null,
    "pagina_trf1": "https://www.trf1.jus.br/trf1/em-atividade/maura-moraes-tayer",
    "telefone": "(61) 3314-5225",
    "biografia_trf1_texto": "**Nomeada por Decreto Presidencial de 13/09/2021, com posse e exerc\u00edcio em 08/10/2021.**\n\nData e Local de Nascimento: 26/09/1957, Para\u00fana-GO\n\n#### Atividade Profissional\n\nNome da Institui\u00e7\u00e3o: Justi\u00e7a Federal / Se\u00e7\u00e3o Judici\u00e1ria de Goi\u00e1s, 1\u00aa Vara, Goi\u00e2nia-GO / Fun\u00e7\u00e3o: Ju\u00edza Federal (Titular) Data de Admiss\u00e3o: 12/08/1992\n\nNome da Institui\u00e7\u00e3o: Pontif\u00edcia Universidade Cat\u00f3lica de Goi\u00e1s / Escola de Direito e Rela\u00e7\u00f5es Internacionais / Fun\u00e7\u00e3o: Professora Data de Admiss\u00e3o: 1996\n\n#### Atividades Profissionais Anteriores\n\nBanco Bandeirantes S/A Tipo de Atividade Exercida: Escritur\u00e1ria Per\u00edodo: 1977 a 1979;\n\nBanco do Estado de Goi\u00e1s Tipo de Atividade: Escritur\u00e1ria Per\u00edodo: 1980 a 1981;\n\nBanco do Estado de Goi\u00e1s Tipo de Atividade: Escritur\u00e1ria Per\u00edodo: 1980 a 1981;\n\nExerc\u00edcio de Advocacia no per\u00edodo de 1981 a 1983;\n\nMinist\u00e9rio P\u00fablico do Estado de Goi\u00e1s Tipo de Atividade: Promotora de Justi\u00e7a Per\u00edodo: 1983 a 1986;\n\nProcuradoria do Estado de Goi\u00e1s Cargo: Procuradora do Estado Per\u00edodo: 1986 a 1989;\n\nMinist\u00e9rio P\u00fablico Federal Cargo: Procuradora da Rep\u00fablica Per\u00edodo: 1989 a 1992.\n\n#### Atividades na Justi\u00e7a Federal\n\nJu\u00edza do Tribunal Regional Eleitoral no per\u00edodo de 26/08/1998 a 31/07/2000;\n\nDiretora do Foro da Se\u00e7\u00e3o Judici\u00e1ria de Goi\u00e1s no per\u00edodo de 01/05/1996 a 30/04/1997;\n\nPresidente da Turma Recursal do Juizado Federal da Se\u00e7\u00e3o Judici\u00e1ria de Goi\u00e1s no per\u00edodo de 14/03/2002 a 25/08/2004;\n\nSubstitui\u00e7\u00e3o e aux\u00edlio no gabinete do Desembargador Federal Jo\u00e3o Batista Gomes Moreira no per\u00edodo de 26/05/2009 a 30/12/2009.\n\n#### Forma\u00e7\u00e3o Acad\u00eamica/Titula\u00e7\u00e3o\n\nCurso Superior de Direito pela Universidade Federal de Goi\u00e1s, Goi\u00e2nia-GO,1976 a 1981;\n\nCurso de Especializa\u00e7\u00e3o em Direito Civil pela Universidade Federal de Goi\u00e1s, em Goi\u00e2nia-GO, conclu\u00eddo em 1982;\n\nCurso de Especializa\u00e7\u00e3o em Direito Processual Civil pela Universidade Federal de Goi\u00e1s, em Goi\u00e2nia, conclu\u00eddo em 1988;\n\nCurso de Especializa\u00e7\u00e3o em Direito Constitucional pela Academia de Pol\u00edcia de Goi\u00e1s, conclu\u00eddo em 1989;\n\nCurso de Mestrado em Direito pela Universidade Federal de Goi\u00e1s, Programa de Direito Agr\u00e1rio, com defesa de disserta\u00e7\u00e3o: Efetiva\u00e7\u00e3o Judicial das Normas Constitucionais sobre Reforma agr\u00e1ria, sendo orientador o Professor Doutor Joel Pimentel de Ulhoa, no per\u00edodo de 2000 a 2003.\n\n#### Aprova\u00e7\u00e3o em Concurso P\u00fablico\n\nMinist\u00e9rio P\u00fablico do Estado de Goi\u00e1s, cargo de Promotor de Justi\u00e7a, 3\u00aa Coloca\u00e7\u00e3o, 1983;\n\nProcuradoria do Estado de Goi\u00e1s, cargo de Procurador do Estado, 1\u00aa coloca\u00e7\u00e3o, 1986;\n\nMinist\u00e9rio P\u00fablico Federal, cargo de Procurador da Rep\u00fablica, 5\u00aa coloca\u00e7\u00e3o, 1989;\n\nTribunal Regional Federal da 1\u00aa Regi\u00e3o, cargo de Juiz Federal, 2\u00aa coloca\u00e7\u00e3o, 1992.\n\n#### Medalhas e Homenagens\n\nMedalha do M\u00e9rito Eleitoral Desembargador Jorge de Morais Jardim, conferida pelo Tribunal Regional Eleitoral de Goi\u00e1s \u2013 2005;\n\nMedalha de Grande-Oficial da Ordem do M\u00e9rito Anhanguera, conferida pelo Estado de Goi\u00e1s \u2013 2006."
  },
  "atuacao_profissional": {},
  "padroes_decisao": {},
  "hipoteses_para_simulacao": {
    "instrucoes": [
      "Inferencias aqui sao aproximacoes para simulacao; nao tratar como fato.",
      "Sempre rotular o agente como simulacao e evitar qualquer uso para enganar terceiros."
    ],
    "tracos_operacionais": [],
    "confianca_global": null
  },
  "riscos_e_cuidados": [
    "Nao usar para impersonacao (nao assinar como a pessoa real).",
    "Nao incluir dados pessoais nao-publicos."
  ],
  "fontes": [
    {
      "url": "https://www.trf1.jus.br/trf1/desembargadores-federais/em-atividade",
      "tipo": "site-oficial",
      "observacao": "Lista (Em atividade)"
    },
    {
      "url": "https://www.trf1.jus.br/trf1/em-atividade/maura-moraes-tayer",
      "tipo": "site-oficial",
      "observacao": "Pagina individual"
    }
  ],
  "atualizado_em": "2026-01-30"
}
