{
  "id": "tjdft-mario-zam-belmiro-rosa",
  "nome": "Des. M\u00e1rio-Zam Belmiro Rosa",
  "nome_completo": null,
  "orgao": "TJDFT",
  "cargo": "Desembargador",
  "situacao": "titular",
  "dados_publicos": {
    "assessor": "Claudia Regina Dias da Rocha",
    "telefones_gabinete": "(61)3103-6514, (61)3103-6512",
    "biografia_tjdft_url": "https://www.tjdft.jus.br/institucional/gestao-do-conhecimento/gestao-da-memoria/biografias/des-mario-zam-belmiro-rosa.pdf",
    "biografia_tjdft_texto": "89 \n \n \nBIOGRAFIA \nDESEMBARGADOR \nM\u00c1RIO-ZAM BELMIRO \n \nDADOS PESSOAIS \nNOME: Mario-Zam Belmiro Rosa \nDATA DE NASCIMENTO: 4/7/1957 \nLOCAL DE NASCIMENTO: Douradoquara - MG \nNACIONALIDADE: brasileira \n \n \n \n \n \n \n \n \nESCOLARIDADE \n \nCurso Superior: Bacharel em Direito pela Associa\u00e7\u00e3o de Ensino Unificado do Distrito Federal (AEUDF), \n1983. \n \n \nCARGOS OCUPADOS \n \n\u00bb Servi\u00e7os prestados a NOVACAP, 1976-1980. \n\u00bb Nomeado Auxiliar Judici\u00e1rio do Tribunal de Justi\u00e7a do Distrito Federal e dos Territ\u00f3rios (TJDFT), 1980-\n1984. \n\u00bb Promotor de Justi\u00e7a do Minist\u00e9rio P\u00fablico do Distrito Federal e Territ\u00f3rios (MPDFT), 1984-1988. \n\u00bb Nomeado Juiz de Direito Substituto da Justi\u00e7a do Distrito Federal, em 22/8/1988. \n\u00bb Promovido por merecimento a Juiz de Direito do TJDFT, em 30/9/1992. \n\u00bb Promovido por merecimento a Desembargador do TJDFT, em 26/10/2004. \n\u00bb Eleito para compor o Tribunal Regional Eleitoral \u2013 TRE/DF, como Membro Suplente, bi\u00eanio 2018/2020. \n\u00bb Eleito para o cargo de Corregedor do TJDFT para o bi\u00eanio 2024-2026 em 20/2/2024, com posse em \n22/4/2024. \n \nOUTROS T\u00cdTULOS \n \n\u00bb Outorgado com a Medalha do M\u00e9rito Eleitoral do DF, 2004. \n\u00bb Outorgado com a Comenda da Ordem do M\u00e9rito Judici\u00e1rio do Distrito Federal e dos Territ\u00f3rios no Grau \nde Gr\u00e3-Cruz, 2004. \n\u00bb Promovido ao grau \u201cGr\u00e3o-Colar\u201d pelo Conselho Tutelar da Comenda da Ordem do M\u00e9rito Judici\u00e1rio do \nDistrito Federal e dos Territ\u00f3rios, em 2010 (PRT OMJDFT 2 de 16 de mar\u00e7o de 2010). \n\u00bb Agraciado com a Medalha M\u00e9rito da Procudaria-Geral do Distrito Federal \u2013 em 26/4/2023 \n \nPROGRAMA HIST\u00d3RIA ORAL \n \n\u00bbYouTube/Playlist/Hist\u00f3riaOral/Mario-ZamBelmiroRosa",
    "biografia_tjdft_resumo": "89 \n \n \nBIOGRAFIA \nDESEMBARGADOR \nM\u00c1RIO-ZAM BELMIRO \n \nDADOS PESSOAIS \nNOME: Mario-Zam Belmiro Rosa \nDATA DE NASCIMENTO: 4/7/1957 \nLOCAL DE NASCIMENTO: Douradoquara - MG \nNACIONALIDADE: brasileira \n \n \n \n \n \n \n \n \nESCOLARIDADE \n \nCurso Superior: Bacharel em Direito pela Associa\u00e7\u00e3o de Ensino Unificado do Distrito Federal (AEUDF), \n1983. \n \n \nCARGOS OCUPADOS \n \n\u00bb Servi\u00e7os prestados a NOVACAP, 1976-1980. \n\u00bb Nomeado Auxiliar Judici\u00e1rio do Tribunal de Justi\u00e7a do Distrito Federal e dos Territ\u00f3rios (TJDFT), 1980-\n1984. \n\u00bb Promotor de Justi\u00e7a do Minist\u00e9rio P\u00fablico do Distrito Federal e Territ\u00f3rios (MPDFT), 1984-1988. \n\u00bb Nomeado Juiz de Direito Substituto da Justi\u00e7a do Distrito Federal, em 22/8/1988. \n\u00bb Promovido por merecimento a Juiz de Direito do TJDFT, em 30/9/1992. \n\u00bb Promovido por merecimento a Desembargador do TJDFT, em 26/10/2004. \n\u00bb Eleito para compor o Tribunal Regional Eleitoral \u2013 TRE/..."
  },
  "atuacao_profissional": {},
  "padroes_decisao": {},
  "hipoteses_para_simulacao": {
    "instrucoes": [
      "Inferencias aqui sao aproximacoes para simulacao; nao tratar como fato.",
      "Sempre rotular o agente como simulacao e evitar qualquer uso para enganar terceiros."
    ],
    "tracos_operacionais": [],
    "confianca_global": null
  },
  "riscos_e_cuidados": [
    "Nao usar para impersonacao (nao assinar como a pessoa real).",
    "Nao incluir dados pessoais nao-publicos."
  ],
  "fontes": [
    {
      "url": "https://www.tjdft.jus.br/institucional/composicao/2a-instancia/desembargadores/ordem-alfabetica",
      "tipo": "site-oficial",
      "observacao": "Ordem alfabetica (2a instancia)"
    }
  ],
  "atualizado_em": "2026-01-30"
}
