{
  "id": "tjdft-maria-ivatonia-barbosa-dos-santos",
  "nome": "Desa. Maria Ivat\u00f4nia Barbosa dos Santos",
  "nome_completo": null,
  "orgao": "TJDFT",
  "cargo": "Desembargador",
  "situacao": "titular",
  "dados_publicos": {
    "assessor": "Juliana Menezes Mendes",
    "telefones_gabinete": "(61)3103-7596",
    "biografia_tjdft_url": "https://www.tjdft.jus.br/institucional/gestao-do-conhecimento/gestao-da-memoria/biografias/130-maria-ivatonia-barbosa-dos-santos.pdf",
    "biografia_tjdft_texto": "130 \nBIOGRAFIA \nDESEMBARGADORA \nMARIA IVAT\u00d4NIA \n \nDADOS PESSOAIS \nNOME: Maria Ivat\u00f4nia Barbosa dos Santos \nDATA DE NASCIMENTO: 15/8/1962 \nLOCAL DE NASCIMENTO: Arraias - TO \nNACIONALIDADE: brasileira \n \n \n \n \n \n \n \n \n \n \n \n \nESCOLARIDADE \n \nEnsino fundamental: Escola Municipal da Canabrava, Munic\u00edpio de Arraias- TO. \nEnsino m\u00e9dio: Instituto Nossa Senhora de Lourdes (Col\u00e9gio das Irm\u00e3s Dominicanas). \nEnsino superior: Bacharel em Direito em 1999, pela Universidade Cat\u00f3lica de Goi\u00e1s \u2013 UCG. \nP\u00f3s-Gradua\u00e7\u00e3o: \n\u00bb Especializa\u00e7\u00e3o em Direito Constitucional Eleitoral pela Universidade de Bras\u00edlia \u2013 UnB; \n\u00bb Especializa\u00e7\u00e3o em Direito Penal pela Universidade Cat\u00f3lica de Bras\u00edlia \u2013 UCB; \n\u00bb Especializa\u00e7\u00f5es em Direito Constitucional, Direito Administrativo, Criminal\u00edstica, Direito Penal e \nProcessual Penal, todas pela Universidade Cat\u00f3lica de Goi\u00e1s \u2013 UCG; \n\u00bb Reciclagem em Estudos Jur\u00eddicos pela Escola Superior da Magistratura do Estado de Goi\u00e1s. \n \nOutros Cursos \n\u00bb 1996/2003 - Franc\u00eas: Alian\u00e7a Francesa de Bras\u00edlia e Universidade de Nancy \u2013 Fran\u00e7a (n\u00edvel superior \u2013 \nconclus\u00e3o do Nancy III em 2003); \n\u00bb 1996/1999 - Alem\u00e3o: Goethe Instituto; 1999/2001; 2003/2004 \u2013 Espanhol: Associa\u00e7\u00e3o dos Magistrados do \nDistrito Federal (AMAGIS-DF); Centro de Cultura Hisp\u00e2nica; \n\u00bb 2001/2004 - Alem\u00e3o: Conversa\u00e7\u00e3o; \n\u00bb 2004/2005 - Italiano: Escola de L\u00ednguas da UnB; \n\u00bb 2007/2009 - Ingl\u00eas: curso intensivo. Instituto Brasas. \n \nEMPREGOS E CARGOS OCUPADOS \n \n\u00bb Auxiliar de Finan\u00e7as na Prefeitura Municipal de Arraias-TO. \n\u00bb Advocacia c\u00edvel e criminal no Escrit\u00f3rio de Advocacia Wanderley de Medeiros, Goi\u00e2nia-GO. \n\u00bb Exerceu o cargo de Delegada de Pol\u00edcia Civil do Estado de Goi\u00e1s. \n\u00bb Posse como Ju\u00edza de Direito Substituta do TJDFT em 7/5/1993. \n\u00bb Promovida para o cargo de Ju\u00edza de Direito em 1\u00ba/2/1996. - Atuou como Ju\u00edza Eleitoral da 12a Zona Eleitoral \nTRE-DF em 2003 e 2004. \n\u00bb Removida pelo crit\u00e9rio de merecimento ao cargo de Juiz de Direito Substituto de Segundo Grau, com posse \nem 15/4/2015, conforme Portaria GPR 554 de 27/3/2015. \n\u00bb Designada pela Presid\u00eancia do TJDFT para atuar como Juiz de Direito Substituto de Segundo Grau na 5\u00aa \nTurma C\u00edvel. \n\u00bb Desembargadora Eleitoral Substituta do TRE-DF de 25/8/2016 a 6/3/2017. \n\u00bb Desembargadora Eleitoral Titular do TRE-DF de 7/3/2017 a 7/3/2019. \n\u00bb Ouvidora do TRE-DF de 21/5/2018 a 7/3/2019. \n\u00bb Diretora da Revista da Escola da Magistratura do Distrito Federal de 2002 a 2008. \n\u00bb Ju\u00edza Coordenadora da Central de Guarda de Objetos de Crime \u2013 CEGOC, de 2009 a 2019. \n\u00bb Promovida, pelo crit\u00e9rio de antiguidade, ao cargo de Desembargadora do TJDFT, com posse em 12/12/2019. \n \nMAGIST\u00c9RIO \n \n\u00bb Professora de Reda\u00e7\u00e3o e Argumenta\u00e7\u00e3o Jur\u00eddica; Direito Penal Militar e Direito Processual Penal Militar \u2013 \nAuditoria Militar \u2013 na Escola Superior da Magistratura do Distrito Federal \u2013 2002 a 2008. \n\u00bb Professora de Portugu\u00eas do Curso de Forma\u00e7\u00e3o de Delegados de Pol\u00edcia na Academia de Pol\u00edcia Civil do \nEstado de Goi\u00e1s. \n\u00bb Professora de Portugu\u00eas (Ensino Fundamental e M\u00e9dio) no Externato S\u00e3o Jos\u00e9 (mesmo col\u00e9gio das Irm\u00e3s \nDominicanas em que cursou o ensino m\u00e9dio), em Goi\u00e2nia-GO. \n \nPARTICIPA\u00c7\u00c3O EM EVENTOS \n \n\u00bb Designado para constituir a comiss\u00e3o encarregada da elabora\u00e7 \u00e3o do Regulamento do Concurso e do \njulgamento das provas para Juiz Substituto da Justi\u00e7a do Distrito Federal, em 1970; \n\u00bb Designado membro da Comiss\u00e3o Especial para Assessorar a Forma\u00e7\u00e3o do Patrim\u00f4nio Art\u00edstico do \nPal\u00e1cio do Buriti, por solicita\u00e7\u00e3o do Governador do Distrito Federal H\u00e9lio Prates de Silveira; \n \nHOMENAGENS E HONRARIAS \n \n\u00bb Outorgada com a comenda da Ordem do M\u00e9rito Judici\u00e1rio do DF e dos Territ\u00f3rios, no grau de Comendadora, \nem 20/3/2001. \n\u00bb Condecorada com a Medalha do M\u00e9rito Eleitoral do Distrito Federal na classe jurista em 30/12/2002. \n\u00bb Promovida ao grau ''Gr\u00e3 -cruz'' da Ordem do M\u00e9rito Judici\u00e1rio do Distrito Federal e dos Territ\u00f3rios em \n2/9/2010. \n\u00bb Agraciado com a Medalha M\u00e9rito da Procudaria-Geral do Distrito Federal \u2013 em 26/4/2023.",
    "biografia_tjdft_resumo": "130 \nBIOGRAFIA \nDESEMBARGADORA \nMARIA IVAT\u00d4NIA \n \nDADOS PESSOAIS \nNOME: Maria Ivat\u00f4nia Barbosa dos Santos \nDATA DE NASCIMENTO: 15/8/1962 \nLOCAL DE NASCIMENTO: Arraias - TO \nNACIONALIDADE: brasileira \n \n \n \n \n \n \n \n \n \n \n \n \nESCOLARIDADE \n \nEnsino fundamental: Escola Municipal da Canabrava, Munic\u00edpio de Arraias- TO. \nEnsino m\u00e9dio: Instituto Nossa Senhora de Lourdes (Col\u00e9gio das Irm\u00e3s Dominicanas). \nEnsino superior: Bacharel em Direito em 1999, pela Universidade Cat\u00f3lica de Goi\u00e1s \u2013 UCG. \nP\u00f3s-Gradua\u00e7\u00e3o: \n\u00bb Especializa\u00e7\u00e3o em Direito Constitucional Eleitoral pela Universidade de Bras\u00edlia \u2013 UnB; \n\u00bb Especializa\u00e7\u00e3o em Direito Penal pela Universidade Cat\u00f3lica de Bras\u00edlia \u2013 UCB; \n\u00bb Especializa\u00e7\u00f5es em Direito Constitucional, Direito Administrativo, Criminal\u00edstica, Direito Penal e \nProcessual Penal, todas pela Universidade Cat\u00f3lica de Goi\u00e1s \u2013 UCG; \n\u00bb Reciclagem em Estudos Jur\u00eddicos pela Escola Super..."
  },
  "atuacao_profissional": {},
  "padroes_decisao": {},
  "hipoteses_para_simulacao": {
    "instrucoes": [
      "Inferencias aqui sao aproximacoes para simulacao; nao tratar como fato.",
      "Sempre rotular o agente como simulacao e evitar qualquer uso para enganar terceiros."
    ],
    "tracos_operacionais": [],
    "confianca_global": null
  },
  "riscos_e_cuidados": [
    "Nao usar para impersonacao (nao assinar como a pessoa real).",
    "Nao incluir dados pessoais nao-publicos."
  ],
  "fontes": [
    {
      "url": "https://www.tjdft.jus.br/institucional/composicao/2a-instancia/desembargadores/ordem-alfabetica",
      "tipo": "site-oficial",
      "observacao": "Ordem alfabetica (2a instancia)"
    }
  ],
  "atualizado_em": "2026-01-30"
}
