{
  "id": "trf1-pedro-braga-filho",
  "nome": "Pedro Braga Filho",
  "nome_completo": null,
  "orgao": "TRF1",
  "cargo": "Desembargador Federal",
  "situacao": "titular",
  "dados_publicos": {
    "gabinete_texto": "Ed. Sede II - 1\u00ba andar - Sala 1N",
    "funcao_administrativa": null,
    "pagina_trf1": "https://www.trf1.jus.br/trf1/em-atividade/pedro-braga-filho",
    "telefone": "(61) 3314-5225",
    "biografia_trf1_texto": "Pedro Braga Filho, natural de Salvador/BA, filho de Pedro Braga e Odete Rodrigues Braga, foi nomeado por Decreto Presidencial de 18/10/2022 (DOU 19/10/2022) e tomou posse no TRF-1\u00aa Regi\u00e3o em 07/11/2022.\n\n#### Instru\u00e7\u00e3o\n\nBacharel em Direito pela Universidade Federal da Bahia (18/08/1978).\n\nMestre em Direito, \u00c1rea de Concentra\u00e7\u00e3o em Direito Econ\u00f4mico, pela Universidade Federal da Bahia (21/09/1998).\n\nAtividades Profissionais\n\nJuiz Federal Substituto, em 10/08/1992, na titularidade plena das 1\u00aa e 2\u00aa Varas da Se\u00e7\u00e3o Judici\u00e1ria do Piau\u00ed (1992 a 1993).\n\nRespondeu pela Se\u00e7\u00e3o Judici\u00e1ria do Piau\u00ed e foi Diretor do Foro (1992 a 1993).\n\nJuiz do Tribunal Regional Eleitoral do Piau\u00ed (1992 a 1993).\n\nJuiz Federal Substituto na titularidade plena e Juiz Federal da 1\u00aa Vara da Se\u00e7\u00e3o Judici\u00e1ria da Bahia (1993 a 2010).\n\nJuiz Diretor do Foro da Se\u00e7\u00e3o Judici\u00e1ria da Bahia (1996 a 1997).\n\nJuiz do Tribunal Regional Eleitoral da Bahia (16/09/1999 a 16/09/2001).\n\nMembro da 1\u00aa Turma Recursal da Se\u00e7\u00e3o Judici\u00e1ria da Bahia (2007 a 2008).\n\nPresidente da 2\u00aa Turma Recursal da Se\u00e7\u00e3o Judici\u00e1ria da Bahia (2008 a 2010), tendo participado neste per\u00edodo de sess\u00f5es da Turma Regional de Uniformiza\u00e7\u00e3o da 1\u00aa Regi\u00e3o.\n\nMembro da 1\u00aa C\u00e2mara Regional Previdenci\u00e1ria da Bahia (23/02/2015 a 23/08/2015).\n\nJuiz Federal Convocado para aux\u00edlio ao Tribunal Regional Federal da 1\u00aa Regi\u00e3o, em decorr\u00eancia das f\u00e9rias do Desembargador Federal Tourinho Neto, no per\u00edodo de 22/06/2009 a 21/07/2009.\n\nParticipou do Mutir\u00e3o das Turmas Recursais da Bahia, realizado de 16/03/2016 a 16/12/2016.\n\nJuiz Federal da 19\u00aa Vara da Se\u00e7\u00e3o judici\u00e1ria da Bahia (2010 a 2022).\n\nProcurador do Trabalho, Minist\u00e9rio P\u00fablico do Trabalho, no per\u00edodo de 17/12/1991 a 09/08/1992.\n\nMonitor concursado da disciplina Introdu\u00e7\u00e3o ao Estudo do Direito, Faculdade de Direito da Universidade Federal da Bahia (2\u00ba semestre de 1975 ao 1\u00ba semestre de 1978).\n\nProfessor Substituto (contratado) da disciplina Introdu\u00e7\u00e3o ao Estudo do Direito, Faculdade de Direito da Universidade Federal da Bahia (07/08/1995 a 31/12/1995).\n\nProfessor da FACS-Faculdades Salvador S/C (01/08/1990 a 31/07/1995-licenciado de 01/03/1992 a 31/07/1995), SESB-Sociedade de Ensino Superior da Bahia (01/03/1998 a 31/05/2000) e FACS S/C (01/06/2000 a 15/03/2002 e 01/03/2003 a 01/02/2005), tendo lecionado as disciplinas Institui\u00e7\u00f5es de Direito P\u00fablico e Privado, Direito Civil e Introdu\u00e7\u00e3o ao Estudo do Direito.\n\n#### Publica\u00e7\u00f5es\n\nO Condom\u00ednio Especial como Sujeito de Direito, na Revista Jur\u00eddica dos Formandos em Direito da UFBA, Ano II, Vol. II, 1997.\n\nGlobaliza\u00e7\u00e3o e a Teoria Geral dos Contratos, no livro Globaliza\u00e7\u00e3o e Direito, Coordenadores Adroaldo Le\u00e3o e Rodolfo Pamplona Filho, Rio de Janeiro, Forense, 2002.\n\nResponsabilidade tribut\u00e1ria de administradores e redirecionamento da execu\u00e7\u00e3o fiscal, na Cole\u00e7\u00e3o Jornada de Estudos Esmaf, 13 - II Jornada de Direito Tribut\u00e1rio, Tribunal Regional Federal da 1\u00aa Regi\u00e3o, Escola da Magistratura Federal da 1\u00aa Regi\u00e3o, Bras\u00edlia, ESMAF, 2012."
  },
  "atuacao_profissional": {},
  "padroes_decisao": {},
  "hipoteses_para_simulacao": {
    "instrucoes": [
      "Inferencias aqui sao aproximacoes para simulacao; nao tratar como fato.",
      "Sempre rotular o agente como simulacao e evitar qualquer uso para enganar terceiros."
    ],
    "tracos_operacionais": [],
    "confianca_global": null
  },
  "riscos_e_cuidados": [
    "Nao usar para impersonacao (nao assinar como a pessoa real).",
    "Nao incluir dados pessoais nao-publicos."
  ],
  "fontes": [
    {
      "url": "https://www.trf1.jus.br/trf1/desembargadores-federais/em-atividade",
      "tipo": "site-oficial",
      "observacao": "Lista (Em atividade)"
    },
    {
      "url": "https://www.trf1.jus.br/trf1/em-atividade/pedro-braga-filho",
      "tipo": "site-oficial",
      "observacao": "Pagina individual"
    }
  ],
  "atualizado_em": "2026-01-30"
}
